paper_id,title,summary,authors_joined,categories_joined,primary_category,published,updated,age_days,summary_chars,abs_url,pdf_url,comment,text_for_embedding
10.32687/0869-866x-2026-34-2-285-290,THE FRACTAL CYBERNETIC ARCHITECTURE OF THE REGIONAL ANTI-NARCOTIC STRATEGY BASED ON MODEL ORIENTED SYSTEMIC ENGINEERING AS A TOOL OF INTERSECTORAL ADAPTIVE MANAGEMENT,"This article substantiates the choice of fractal cybernetic architecture of regional anti-narcotic strategy based on the principles of the model-oriented systemic engineering. It is established that the tools of both traditional management by objectives and KPI-oriented management have predominantly reactive and fragmented patterns that reduces their efficiency in conditions of high dynamic of narcotics market and interdepartmental dissociation. The methodological basis was composed by the W. R. Ashbys Law of requisite variety and the S. Beers model of viable system that permitted to interpret the anti-narcotic strategy as adaptive multi-level social medical system. As a result, the executable fractal cybernetic model-based systems engineering architecture was formed that incorporated goal-setting, structural, modeling, digital, and measurement loops and ensured goal traceability, coordination of interdepartmental processes and closing feedback loops. On the basis of materials from the Kabardino-Balkarian Republic, the feasibility of the architecture through the digital platform AURA-FORECAST, integration of interdepartmental data and support of management decisions in the cycle of monitoring and adjustment is demonstrated. The obtained results form the evidence-based basis of transition from reactive anti-narcotic policy to predictive and adaptive model of management in health care.","A. V. Akhokhova, V. V. Lyutsko, M. K. Tkhagapsoeva, D. V. Zheligotova",,,2026-12-15,2026-04-23,-188,1406,https://doi.org/10.32687/0869-866x-2026-34-2-285-290,https://journal-nriph.ru/journal/article/viewFile/2610/5460,"Problems of Social Hygiene, Public Health and History of Medicine","Title: THE FRACTAL CYBERNETIC ARCHITECTURE OF THE REGIONAL ANTI-NARCOTIC STRATEGY BASED ON MODEL ORIENTED SYSTEMIC ENGINEERING AS A TOOL OF INTERSECTORAL ADAPTIVE MANAGEMENT
Summary: This article substantiates the choice of fractal cybernetic architecture of regional anti-narcotic strategy based on the principles of the model-oriented systemic engineering. It is established that the tools of both traditional management by objectives and KPI-oriented management have predominantly reactive and fragmented patterns that reduces their efficiency in conditions of high dynamic of narcotics market and interdepartmental dissociation. The methodological basis was composed by the W. R. Ashbys Law of requisite variety and the S. Beers model of viable system that permitted to interpret the anti-narcotic strategy as adaptive multi-level social medical system. As a result, the executable fractal cybernetic model-based systems engineering architecture was formed that incorporated goal-setting, structural, modeling, digital, and measurement loops and ensured goal traceability, coordination of interdepartmental processes and closing feedback loops. On the basis of materials from the Kabardino-Balkarian Republic, the feasibility of the architecture through the digital platform AURA-FORECAST, integration of interdepartmental data and support of management decisions in the cycle of monitoring and adjustment is demonstrated. The obtained results form the evidence-based basis of transition from reactive anti-narcotic policy to predictive and adaptive model of management in health care.
Authors: A. V. Akhokhova, V. V. Lyutsko, M. K. Tkhagapsoeva, D. V. Zheligotova"
10.22363/2687-0088-48784,"Systemic functional linguistics and social cognition: A theoretical approach to the relationship between language, society and culture","In this article, I argue in favor of strengthening the relationship between Systemic Functional Linguistics (SFL) and Social Cognition in order to answer the following question: how could we extend the understanding of how linguistic choices are affected or complemented cognitively? I thus attempt to integrate the views introduced by SFL and Social Cognition by recognizing that the categories from the former, added to the principles of the latter, may lead researchers in linguistics - both theoretical and applied - to a broader field of comprehension which may have some impact on all ways of apprehending the social element. The study draws on categories proposed by SFL as well as the propositions of Social Cognition. I assume, therefore, that there are social, cultural, and cognitive reasons that, if integrated, impact discourse semantics in a manner that contributes positively to an effective communication. That is why a few elements from sociology - egological perspective, dialectic perspective of social reality, sociocultural memory - are used to explain aspects of the social construction of reality and to support the discussions undertaken, in addition to providing some input to answer the following questions: (1) what is the relationship between SFL and Social Cognition, and (2) what does this relationship imply for our analyses? These reflections point to the role of language in the construction of possible worlds on levels that permeate the situational and cultural contexts and indicate that social cognition is a condition for understanding the interrelationship between lexicogrammar and discourse semantics.",Cláudio Márcio do Carmo,,,2026-12-15,2026-05-05,-188,1642,https://doi.org/10.22363/2687-0088-48784,https://journals.rudn.ru/linguistics/article/viewFile/50065/26994,Russian Journal of Linguistics,"Title: Systemic functional linguistics and social cognition: A theoretical approach to the relationship between language, society and culture
Summary: In this article, I argue in favor of strengthening the relationship between Systemic Functional Linguistics (SFL) and Social Cognition in order to answer the following question: how could we extend the understanding of how linguistic choices are affected or complemented cognitively? I thus attempt to integrate the views introduced by SFL and Social Cognition by recognizing that the categories from the former, added to the principles of the latter, may lead researchers in linguistics - both theoretical and applied - to a broader field of comprehension which may have some impact on all ways of apprehending the social element. The study draws on categories proposed by SFL as well as the propositions of Social Cognition. I assume, therefore, that there are social, cultural, and cognitive reasons that, if integrated, impact discourse semantics in a manner that contributes positively to an effective communication. That is why a few elements from sociology - egological perspective, dialectic perspective of social reality, sociocultural memory - are used to explain aspects of the social construction of reality and to support the discussions undertaken, in addition to providing some input to answer the following questions: (1) what is the relationship between SFL and Social Cognition, and (2) what does this relationship imply for our analyses? These reflections point to the role of language in the construction of possible worlds on levels that permeate the situational and cultural contexts and indicate that social cognition is a condition for understanding the interrelationship between lexicogrammar and discourse semantics.
Authors: Cláudio Márcio do Carmo"
10.22363/2312-8143-2026-27-1-70-80,Factors Influencing the Formation of Augmented Reality Systems,"This study identifies and analyzes the factors influencing the formation, functioning, usability, and efficiency of augmented reality (AR) systems. The first group of factors is determined by the technical characteristics of the system and the information infrastructure. The quality of the sensors determines the degree of detail and reliability of the initial data; devices with low accuracy can cause delays, drift, or jitter, which negatively affect the stability of the virtual object. Accurate positioning and tracking depend on GPS signals, visual-inertial odometry, or marker-based systems that can be affected by multichannel interference, signal jamming, or sensor noise, resulting in a mismatch between the physical and virtual worlds. Network bandwidth limitations affect real-time data streaming, cloud rendering, and multi-user synchronization, and unreliable connections result in skips or delays. The second group of factors refers to environmental conditions. Fluctuations in lighting can cause noise, decrease contrast, and disrupt object detection algorithms, which require the use of reliable computer vision techniques. This study proposes a solution to problems that improves the quality of augmented reality content and is key to the creation and development of AR systems.","Larisa V. Kruglova, Fafa K. Ceesay, Rokhaya Samb",,,2026-12-15,2026-04-13,-188,1296,https://doi.org/10.22363/2312-8143-2026-27-1-70-80,https://journals.rudn.ru/engineering-researches/article/viewFile/49751/26911,RUDN Journal of Engineering Researches,"Title: Factors Influencing the Formation of Augmented Reality Systems
Summary: This study identifies and analyzes the factors influencing the formation, functioning, usability, and efficiency of augmented reality (AR) systems. The first group of factors is determined by the technical characteristics of the system and the information infrastructure. The quality of the sensors determines the degree of detail and reliability of the initial data; devices with low accuracy can cause delays, drift, or jitter, which negatively affect the stability of the virtual object. Accurate positioning and tracking depend on GPS signals, visual-inertial odometry, or marker-based systems that can be affected by multichannel interference, signal jamming, or sensor noise, resulting in a mismatch between the physical and virtual worlds. Network bandwidth limitations affect real-time data streaming, cloud rendering, and multi-user synchronization, and unreliable connections result in skips or delays. The second group of factors refers to environmental conditions. Fluctuations in lighting can cause noise, decrease contrast, and disrupt object detection algorithms, which require the use of reliable computer vision techniques. This study proposes a solution to problems that improves the quality of augmented reality content and is key to the creation and development of AR systems.
Authors: Larisa V. Kruglova, Fafa K. Ceesay, Rokhaya Samb"
10.22363/2687-0088-47921,Legitimacy of varieties of English as a non-native language,"The article discusses the status of varieties of a pluricentric language, such as Russian English, Chinese English, among others. Some linguists waive this status because the language system of these varieties is not based on their own norms but is grounded on the norms of other varieties, either British or American. However, speakers of these varieties use them as lingua francas for communication and their Englishes are easily recognized as non-British or non-American, i.e., their varieties serve for linguacultural identification of the users. This is due to the fact that each variety is underpinned by the users’ culture and mindset and reflects traces of the users’ native languages, which allows us to make a conclusion that local varieties are not bound to the “political map” of the region (one of the critical arguments against world Englishes) but they are associated with their ethnic cultures. The article is an analytical review of the debatable issues of the World Englishes paradigm, English as a Lingua Franca theory, and English as an International Language concept. It aims to reveal factors that make it possible to recognize Expanding Circle varieties, to state the major features and functions of Russian English. The author focuses on some practical textbooks aimed at teaching world Englishes and their cultures. The method of corpus analysis of Russian English was used. Quantitative and comparative analysis of research articles in the leading sociolinguistic journals ( World Englishes and English Today ) was conducted to reveal the overwhelming predominance of Chinese English research as compared with that of Russian English. The author concludes that world Englishes of the Expanding Circle are legitimate varieties that have variable exonorms. Certain trends for their endonorms to start forming are revealed.",Zoya G. Proshina,,,2005-01-01,2026-05-05,7830,1846,https://doi.org/10.22363/2687-0088-47921,https://journals.rudn.ru/linguistics/article/viewFile/50067/26996,Russian Journal of Linguistics,"Title: Legitimacy of varieties of English as a non-native language
Summary: The article discusses the status of varieties of a pluricentric language, such as Russian English, Chinese English, among others. Some linguists waive this status because the language system of these varieties is not based on their own norms but is grounded on the norms of other varieties, either British or American. However, speakers of these varieties use them as lingua francas for communication and their Englishes are easily recognized as non-British or non-American, i.e., their varieties serve for linguacultural identification of the users. This is due to the fact that each variety is underpinned by the users’ culture and mindset and reflects traces of the users’ native languages, which allows us to make a conclusion that local varieties are not bound to the “political map” of the region (one of the critical arguments against world Englishes) but they are associated with their ethnic cultures. The article is an analytical review of the debatable issues of the World Englishes paradigm, English as a Lingua Franca theory, and English as an International Language concept. It aims to reveal factors that make it possible to recognize Expanding Circle varieties, to state the major features and functions of Russian English. The author focuses on some practical textbooks aimed at teaching world Englishes and their cultures. The method of corpus analysis of Russian English was used. Quantitative and comparative analysis of research articles in the leading sociolinguistic journals ( World Englishes and English Today ) was conducted to reveal the overwhelming predominance of Chinese English research as compared with that of Russian English. The author concludes that world Englishes of the Expanding Circle are legitimate varieties that have variable exonorms. Certain trends for their endonorms to start forming are revealed.
Authors: Zoya G. Proshina"
10.32687/0869-866x-2026-34-1-25-33,THE MODE,"The article presents results of comparative analysis of modern telemedicine technologies and organizational models of their implementation in health care system. On the basis of study of national and international experience, the rationale for perspective model of geriatric telemedicine contact center is presented. Its role and place in the structure of remote medical care support in the Russian Federation is determined. The article considers key directions application of areas of telemedicine: synchronous and asynchronous tele-consultation, remote methodological support, tele-training and tele-monitoring. The elderly patient usually has difficulty with moving on long distances. Therefore, special attention is paid to development of out-of-office and home tele-monitoring using wearable devices, expert systems, and soft hardware complexes permitting to automatize processes of diagnostic and correction and to apply remote interaction as well. The original model of geriatric telemedicine contact center includes front-office for primary reception and routing of requests, counseling module with involvement of accredited experts, methodological module for supporting various categories of users and monitoring module for dynamic control of indicators of life activity. The model is primarily directed toward elderly patients with limited mobility that is conditioned by high need of this category of citizens for accessible and continuous medical care. The economic efficiency of telemedicine solutions capable to decrease treatment costs, to reduce the number of hospitalizations and to unload hospital sector. In conclusion, expediency of organization of Federal profile center instead of multiple territorial divisions to optimize resources and to ensure uniform standards of remote geriatric care on national basis is substantiated.","M. A. Yakushin, E. N. Kabaeva, A. V. Vorobeva",,,2005-01-01,2026-02-22,7830,1848,https://doi.org/10.32687/0869-866x-2026-34-1-25-33,https://journal-nriph.ru/journal/article/viewFile/2535/5429,"Problems of Social Hygiene, Public Health and History of Medicine","Title: THE MODE
Summary: The article presents results of comparative analysis of modern telemedicine technologies and organizational models of their implementation in health care system. On the basis of study of national and international experience, the rationale for perspective model of geriatric telemedicine contact center is presented. Its role and place in the structure of remote medical care support in the Russian Federation is determined. The article considers key directions application of areas of telemedicine: synchronous and asynchronous tele-consultation, remote methodological support, tele-training and tele-monitoring. The elderly patient usually has difficulty with moving on long distances. Therefore, special attention is paid to development of out-of-office and home tele-monitoring using wearable devices, expert systems, and soft hardware complexes permitting to automatize processes of diagnostic and correction and to apply remote interaction as well. The original model of geriatric telemedicine contact center includes front-office for primary reception and routing of requests, counseling module with involvement of accredited experts, methodological module for supporting various categories of users and monitoring module for dynamic control of indicators of life activity. The model is primarily directed toward elderly patients with limited mobility that is conditioned by high need of this category of citizens for accessible and continuous medical care. The economic efficiency of telemedicine solutions capable to decrease treatment costs, to reduce the number of hospitalizations and to unload hospital sector. In conclusion, expediency of organization of Federal profile center instead of multiple territorial divisions to optimize resources and to ensure uniform standards of remote geriatric care on national basis is substantiated.
Authors: M. A. Yakushin, E. N. Kabaeva, A. V. Vorobeva"
10.22363/2687-0088-46513,Language,"Contemporary scholarly discourse on gender-inclusive communication remains predominantly descriptive, often avoiding a systematic critical analysis of its internal contradictions and social consequences. However, the growing social tension around new linguistic norms, their ideologization, and direct impact on public institutions demand unbiased examination. The aim of this article is to identify and analyze the key paradoxes generated by gender-inclusive communication, which persist despite its proclaimed goals of equality and respect. The research material comprises English-language texts of various genres and styles, including scholarly articles, media publications, documents from university websites, healthcare institutions, governmental, non-governmental, and commercial organizations, as well as data from blogs and social networks from the period 2017 to 2025. This allowed us to examine gender-inclusive communication both in the sphere of academic reflection and within the context of public practice. The methodological framework is based on critical discourse analysis, which interprets linguistic changes as a struggle for power, and Lotman’s theory of the semiosphere, which views inclusive language as a phenomenon of cultural dynamics. The study establishes that inclusive communication generates a complex of systemic contradictions across different dimensions: linguistic (between the striving to erase and simultaneously multiply gender differences, leading to semantic tautology and a violation of linguistic conventionality); social (where inclusivity in practice becomes a tool for excluding dissenting voices and marginalizing the experiences of traditional groups); ethical (encompassing the conflict between the ideology of self-identification and biological realities, as well as the imposition of Anglo-centric models onto other linguacultures). Interpreting the results through the chosen methodological lens reveals that inclusive language functions not only as a discourse of power but also as a tool of auto-communication, aimed at redefining the core of the cultural semiosphere and consolidating a “progressive” identity. The findings open perspectives for comparative studies on the reception of inclusive practices in different linguacultures and for interdisciplinary research into the long-term social effects of linguistic reform.",Elena S. Gritsenko,,,2005-01-01,2026-05-05,7830,2377,https://doi.org/10.22363/2687-0088-46513,https://journals.rudn.ru/linguistics/article/viewFile/50066/26995,Russian Journal of Linguistics,"Title: Language
Summary: Contemporary scholarly discourse on gender-inclusive communication remains predominantly descriptive, often avoiding a systematic critical analysis of its internal contradictions and social consequences. However, the growing social tension around new linguistic norms, their ideologization, and direct impact on public institutions demand unbiased examination. The aim of this article is to identify and analyze the key paradoxes generated by gender-inclusive communication, which persist despite its proclaimed goals of equality and respect. The research material comprises English-language texts of various genres and styles, including scholarly articles, media publications, documents from university websites, healthcare institutions, governmental, non-governmental, and commercial organizations, as well as data from blogs and social networks from the period 2017 to 2025. This allowed us to examine gender-inclusive communication both in the sphere of academic reflection and within the context of public practice. The methodological framework is based on critical discourse analysis, which interprets linguistic changes as a struggle for power, and Lotman’s theory of the semiosphere, which views inclusive language as a phenomenon of cultural dynamics. The study establishes that inclusive communication generates a complex of systemic contradictions across different dimensions: linguistic (between the striving to erase and simultaneously multiply gender differences, leading to semantic tautology and a violation of linguistic conventionality); social (where inclusivity in practice becomes a tool for excluding dissenting voices and marginalizing the experiences of traditional groups); ethical (encompassing the conflict between the ideology of self-identification and biological realities, as well as the imposition of Anglo-centric models onto other linguacultures). Interpreting the results through the chosen methodological lens reveals that inclusive language functions not only as a discourse of power but also as a tool of auto-communication, aimed at redefining the core of the cultural semiosphere and consolidating a “progressive” identity. The findings open perspectives for comparative studies on the reception of inclusive practices in different linguacultures and for interdisciplinary research into the long-term social effects of linguistic reform.
Authors: Elena S. Gritsenko"
