paper_id,title,summary,authors_joined,categories_joined,primary_category,published,updated,age_days,summary_chars,abs_url,pdf_url,comment,text_for_embedding
10.14414/jbb.v15i01.5538,Model Ke,"Dividend policy is an important corporate decision in determining the proportion of profits distributed to shareholders and reflects a company’s financial condition and performance. This study aims to analyze the effect of profitability, liquidity, and capital adequacy on dividend policy, with firm size as a moderating variable, in Regional Development Banks (BPD) in Indonesia during the 2020–2024 period. The research problem focuses on differences in dividend policies among BPDs and the financial factors influencing them. This study uses secondary data in the form of annual financial statements obtained from the official website of the Financial Services Authority (OJK). The sampling method employed was purposive sampling, resulting in a sample of 24 BPDs with a total of 120 observations. Data analysis techniques include descriptive statistical analysis, multiple linear regression, and Moderated Regression Analysis (MRA). The results indicate that profitability has a positive and significant effect on dividend policy, liquidity has a positive but insignificant effect, and capital adequacy has a negative and significant effect on dividend policy. Firm size is unable to moderate the effect of profitability and liquidity on dividend policy. The findings may serve as a consideration for BPD management in making dividend distribution decisions.","Sindy Friska Alfiana, Linda Purnama Sari",,,2005-01-01,2026-03-25,7830,1362,https://doi.org/10.14414/jbb.v15i01.5538,https://journal.perbanas.ac.id/index.php/jbb/article/download/5538/1998,Journal of Business &amp; Banking,"Title: Model Ke
Summary: Dividend policy is an important corporate decision in determining the proportion of profits distributed to shareholders and reflects a company’s financial condition and performance. This study aims to analyze the effect of profitability, liquidity, and capital adequacy on dividend policy, with firm size as a moderating variable, in Regional Development Banks (BPD) in Indonesia during the 2020–2024 period. The research problem focuses on differences in dividend policies among BPDs and the financial factors influencing them. This study uses secondary data in the form of annual financial statements obtained from the official website of the Financial Services Authority (OJK). The sampling method employed was purposive sampling, resulting in a sample of 24 BPDs with a total of 120 observations. Data analysis techniques include descriptive statistical analysis, multiple linear regression, and Moderated Regression Analysis (MRA). The results indicate that profitability has a positive and significant effect on dividend policy, liquidity has a positive but insignificant effect, and capital adequacy has a negative and significant effect on dividend policy. Firm size is unable to moderate the effect of profitability and liquidity on dividend policy. The findings may serve as a consideration for BPD management in making dividend distribution decisions.
Authors: Sindy Friska Alfiana, Linda Purnama Sari"
10.64592/cpssg.2026.2,Hybrid M,"The paper deals with the issues of increasing the efficiency of functioning of synergetic robotic systems by searching for waysto improve the simulationmodels underlying them (increasing the degree of completeness and adequacy). The architecture of a hybrid simulation model is proposed on the example of a basic complex modeа of functioningания of a collaborative process. The model is built according to the modular principle and combines discrete-event modules and real-time modules (dynamic modeling, etc.). The platform solution gives the model maximum flexibility when it is specialized for a specific technological process. The functionality of the model is aimed not only at modeling regular situations, but also allows you to forecast the impact of disturbing factors on the development of the situation and the quality of the joint production process of the operator and robot. The interface of the model allows you to include the operator in the planning process of tactical decisions, due to the possibility of organizing control actions on it by means of the effector system.","M. Gorkavyy, Y. Ivanov, D. Grabar, D. Solovev",,,2005-01-01,2025-09-24,7830,1088,https://doi.org/10.64592/cpssg.2026.2,,International Conference on Cyber-Physical Systems in Smart Grids (CPSSG-2026),"Title: Hybrid M
Summary: The paper deals with the issues of increasing the efficiency of functioning of synergetic robotic systems by searching for waysto improve the simulationmodels underlying them (increasing the degree of completeness and adequacy). The architecture of a hybrid simulation model is proposed on the example of a basic complex modeа of functioningания of a collaborative process. The model is built according to the modular principle and combines discrete-event modules and real-time modules (dynamic modeling, etc.). The platform solution gives the model maximum flexibility when it is specialized for a specific technological process. The functionality of the model is aimed not only at modeling regular situations, but also allows you to forecast the impact of disturbing factors on the development of the situation and the quality of the joint production process of the operator and robot. The interface of the model allows you to include the operator in the planning process of tactical decisions, due to the possibility of organizing control actions on it by means of the effector system.
Authors: M. Gorkavyy, Y. Ivanov, D. Grabar, D. Solovev"
10.5559/di.di.34.4.01,How do Ethical Leaders Promote Employees' Feedback-Seeking Behaviours? A Serial Mediation Model,,"Wasim Ul Rehman, Mustafa Bekmezci, Lütfi Sürücü, Kamran Ali, Anam Mustansar",,,2026-12-31,2026-02-28,-204,0,https://doi.org/10.5559/di.di.34.4.01,,Drustvena istrazivanja,"Title: How do Ethical Leaders Promote Employees' Feedback-Seeking Behaviours? A Serial Mediation Model
Summary: 
Authors: Wasim Ul Rehman, Mustafa Bekmezci, Lütfi Sürücü, Kamran Ali, Anam Mustansar"
10.51153/mf.v20.i2.709,A Moderating and mediating model of innovation performance,,"Saira Naz, Fatima Liaquat",,,2026-12-31,2026-05-05,-204,0,https://doi.org/10.51153/mf.v20.i2.709,https://marketforcesjournal.kiet.edu.pk/index.php/marketforces/article/download/709/456,Market Forces,"Title: A Moderating and mediating model of innovation performance
Summary: 
Authors: Saira Naz, Fatima Liaquat"
10.35429/jhrt.2026.12.27.3.1.5,"Analysis of leadership in small family businesses in the municipality of Centro, Tabasco, to generate a development model",,"Karen Daheli Madrigal-Pérez, Leticia López-Valdivieso, David Antonio García-Reyes, Jucelly Castro-De la Cruz",,,2026-12-30,2026-04-23,-203,0,https://doi.org/10.35429/jhrt.2026.12.27.3.1.5,,Journal of Human Resources Training,"Title: Analysis of leadership in small family businesses in the municipality of Centro, Tabasco, to generate a development model
Summary: 
Authors: Karen Daheli Madrigal-Pérez, Leticia López-Valdivieso, David Antonio García-Reyes, Jucelly Castro-De la Cruz"
